{
  "id": "comms_array",
  "display_name_key": "LANDMARK_COMMS_ARRAY",
  "sprite": "res://assets/original/landmarks/comms_array_hd.webp",
  "scale": 0.64,
  "reserved_radius": 500,
  "placement_radius": [
    1450,
    2600
  ],
  "collision": {
    "shape": "box",
    "size": [
      500,
      300
    ]
  },
  "spin_speed_range": [
    0,
    0
  ],
  "drift_amplitude": 0.5,
  "ambient_effect": "none",
  "texture_reference_size": 864
}
