{
  "id": "fractured_moonlet",
  "display_name_key": "LANDMARK_FRACTURED_MOONLET",
  "sprite": "res://assets/original/landmarks/fractured_moonlet_hd.webp",
  "scale": 0.78,
  "reserved_radius": 570,
  "placement_radius": [
    1700,
    2850
  ],
  "collision": {
    "shape": "circle",
    "radius": 255
  },
  "spin_speed_range": [
    -0.0018,
    0.0018
  ],
  "drift_amplitude": 0,
  "ambient_effect": "dust",
  "texture_reference_size": 512
}
