{
  "id": "derelict_explorer",
  "display_name_key": "LANDMARK_DERELICT_EXPLORER",
  "sprite": "res://assets/original/landmarks/derelict_explorer_hd.webp",
  "scale": 0.64,
  "reserved_radius": 590,
  "placement_radius": [
    1650,
    2900
  ],
  "collision": {
    "shape": "box",
    "size": [
      600,
      220
    ]
  },
  "spin_speed_range": [
    -0.0012,
    0.0012
  ],
  "drift_amplitude": 0.5,
  "ambient_effect": "ion_glow",
  "texture_reference_size": 1024
}
