{
  "id": "mining_rig",
  "display_name_key": "LANDMARK_MINING_RIG",
  "sprite": "res://assets/original/landmarks/mining_rig_hd.webp",
  "scale": 0.66,
  "reserved_radius": 520,
  "placement_radius": [
    1550,
    2650
  ],
  "collision": {
    "shape": "box",
    "size": [
      500,
      330
    ]
  },
  "spin_speed_range": [
    0,
    0
  ],
  "drift_amplitude": 0,
  "ambient_effect": "dust",
  "texture_reference_size": 832
}
