{
  "id": "cargo_waystation",
  "display_name_key": "LANDMARK_CARGO_WAYSTATION",
  "sprite": "res://assets/original/landmarks/cargo_waystation_hd.webp",
  "scale": 0.58,
  "reserved_radius": 500,
  "placement_radius": [
    1450,
    2450
  ],
  "collision": {
    "shape": "circle",
    "radius": 280
  },
  "spin_speed_range": [
    0,
    0
  ],
  "drift_amplitude": 0.5,
  "ambient_effect": "none"
}
