{
  "id": "relay_satellite",
  "display_name_key": "LANDMARK_RELAY_SATELLITE",
  "sprite": "res://assets/original/landmarks/relay_satellite_hd.webp",
  "scale": 0.62,
  "reserved_radius": 430,
  "placement_radius": [
    1350,
    2450
  ],
  "collision": {
    "shape": "box",
    "size": [
      280,
      390
    ]
  },
  "spin_speed_range": [
    -0.002,
    0.002
  ],
  "drift_amplitude": 1,
  "ambient_effect": "none",
  "texture_reference_size": 704
}
